{"algorithm":"reproassert-v021-automated-evaluation-aggregate-v1","automated_evidence_sha256":"ba92058705788ccb228a2e86cf71cf770227deadf05ec55b5d5502f6f5044823","benchmark_version":"0.2.1","case_count":20,"claims":{"automated_evidence_validated":true,"full_denominator_reported":true,"human_reviewed":false,"l2_causal_claim":false,"maintainer_validated":false},"counts":{"accepted":0,"oracle_executed":3,"rejected":20,"total":20},"generation_barrier_sha256":"fd99cdf3e0682511562582f1a6d8656d1267bb8e8a29eff14e213d1ef8370d48","lineage_commitment_sha256":"1e3fe1c74d0c2254294ce64e509aa21f8ed9fc6e0fac1a2a30999760239f0cae","receipt_sha256":"861e0d492775feaa1df8210cc98313b0713e4e425608be288feb7dce0f08e87c","request_set_sha256":"6e247092cbfa56cccdda69665858d93baa1e99038f3df0625ca61d04c63bd134","results":[{"accepted":false,"case_id":"rk-v0.2-001","classification":"candidate_contract_rejected","receipt_sha256":"551149806e617096b9dd42944004f002f10c7a0b675cfa6ce8f8a2a6d1ad0325"},{"accepted":false,"case_id":"rk-v0.2-002","classification":"candidate_contract_rejected","receipt_sha256":"6c249f0236a0ba898206915043d25b9f56dfed4f2706926adcd4e62af76ea4cf"},{"accepted":false,"case_id":"rk-v0.2-003","classification":"wrong_or_flaky_failure","receipt_sha256":"1e0e98693ff8dc28f3d24086c96804500088b768e973e8f79542eb1ef9629ba8"},{"accepted":false,"case_id":"rk-v0.2-004","classification":"candidate_contract_rejected","receipt_sha256":"49fee5fc80743f54cb094944d405d81ea3cd586c9aaf9f6925af165012f8b347"},{"accepted":false,"case_id":"rk-v0.2-005","classification":"candidate_contract_rejected","receipt_sha256":"336e9ef0583fb235c312a959498fa3ec2ec21878138f33caf26bb4c597cd2b1a"},{"accepted":false,"case_id":"rk-v0.2-006","classification":"candidate_contract_rejected","receipt_sha256":"c6fa7cad045379be6f32ab3d6dc011dfa2ccb4dfa4224ca40fdb0318a111823e"},{"accepted":false,"case_id":"rk-v0.2-007","classification":"wrong_or_flaky_failure","receipt_sha256":"0108866481c738e0e3ecc1822cce698bfb1d17ede61fae2fadcc8a3689486c4c"},{"accepted":false,"case_id":"rk-v0.2-008","classification":"candidate_contract_rejected","receipt_sha256":"7c357bc958ddd7cf171ebb0603e1358414a936daf414f567e5ecde54a0288517"},{"accepted":false,"case_id":"rk-v0.2-009","classification":"candidate_contract_rejected","receipt_sha256":"ab4dc9efac61d4f21f9b5f128ebbce16dea8711f70090f3b84788e2f4165a4c6"},{"accepted":false,"case_id":"rk-v0.2-010","classification":"candidate_contract_rejected","receipt_sha256":"3694c5b23b4050c13d22dcf9877e4456e82f0dcecf6e28c09d26c0f1c135957b"},{"accepted":false,"case_id":"rk-v0.2-011","classification":"wrong_or_flaky_failure","receipt_sha256":"5dafeda019d406032e34d618ba90daab5e5277affc81b09daca93a66c55ecfbf"},{"accepted":false,"case_id":"rk-v0.2-012","classification":"candidate_contract_rejected","receipt_sha256":"bdf2af8aef6b77b4387f93274a510ee47c4ea93bedfc0efeca74d62c747c0c7f"},{"accepted":false,"case_id":"rk-v0.2-013","classification":"candidate_contract_rejected","receipt_sha256":"b1214ee24050420ce655ce10e36db80db4dfbbdc20699e457639dcd2a52f0019"},{"accepted":false,"case_id":"rk-v0.2-014","classification":"candidate_contract_rejected","receipt_sha256":"c6d62be960461f4d0665462bc80f41d4b8c2d227050cc7ba4052ca1eebf7a147"},{"accepted":false,"case_id":"rk-v0.2-015","classification":"candidate_contract_rejected","receipt_sha256":"53de8df527bff03195864a53009dc7bcd6efa34e418ef7ad034bacfebbcbe000"},{"accepted":false,"case_id":"rk-v0.2-016","classification":"candidate_contract_rejected","receipt_sha256":"159323165c601917488f88b5d86baee1f31f24e7e545315453a4856423959f89"},{"accepted":false,"case_id":"rk-v0.2-017","classification":"candidate_contract_rejected","receipt_sha256":"275d4c258980ab0eb2c0d9c2a13f9614d800e9e7ed300623c175e2a56d24113e"},{"accepted":false,"case_id":"rk-v0.2-018","classification":"candidate_contract_rejected","receipt_sha256":"91c2b7e3e0ba322ca29ff294d0a172e78db3cd70cdae40d3217abb6dcc621ba0"},{"accepted":false,"case_id":"rk-v0.2-019","classification":"candidate_contract_rejected","receipt_sha256":"2603068cb3c2c4187583f20b86ad08a54f8a77b6d5b0120e5302f0e74191ba99"},{"accepted":false,"case_id":"rk-v0.2-020","classification":"candidate_contract_rejected","receipt_sha256":"fad1e46152c1511a8bb40c25fb8fe172f48d7392a7156132162c22a273e1bc14"}],"schema_version":"1.0.0","tool_git_sha":"d1905a25c93034fcfbc580a63e333026484ec959"}
